"time","speaker","text","notes"
"","B","Yes, and reading is the same. ",""
"","A","And spelling! Yes. ",""
"29.23","A","And what about other things that would have changed?  What about the more crowded ... it's not so crowded just here, is it, in Quakers Hill ... but in the surrounds, the bigger shopping centres and the parking stations? ",""
"","B","Yes.  Well Blacktown is very crowded now.  And I can remember when Blacktown only had five or six shops when I was a girl.  And there was a chemist shop and five or six shops in the main street.  And you knew practically everybody, but now you go to Blacktown and you never know anybody! ",""
"","A","What about here in Quakers Hill? ",""
"","B","Oh we did know most of the people.   ",""
"","A","You still would or ...? ",""
"","B","Not a great lot.  It's changed then - it's changing more. ",""
"30.14","A","What about security? ",""
"","B","14 Well we used to leave the back door open and the ice-man used to come and put the ice in.  But we wouldn't go and leave the back door open now.  And we've got two iron bars behind the back door if we've got to go out at night. ",""
"","A","Really, so that's not so good is it?  That's a change that&apos;s not been for the better! ",""
"","B","It's not pleasant to think you've got to live with that.  We haven&apos;t been robbed, thank goodness.  My son has, be we haven’t. ",""
"","A","It's good to take those precautions. ",""
"30.50","A","And what about the friendliness in the area?  Have you noticed it's not so friendly? ",""
"","B","It's not so friendly as it used to be. ",""
"","A","Is that because it's bigger? ",""
"","B","Yes. ",""
"","A","It's not so personal and you don't know everybody? ",""
"","B","No.  It's not as personal.  I have a friend that comes around a couple or three times a week for a cup of tea of an afternoon.  END SIDE A SIDE B ",""
"1.29","A","And what about the general landscape?  You know, changing from a more rural place to a more suburban area - how do you feel about that?  Has that actually happened here very much? ",""
"","B","Yes.  There's been a lot more houses go up.  They're getting closer together.  I feel the Council could do a lot more for the older area where we live.  I think that ... we've lived here for 40-odd years and we haven't got a footpath on our side, but the new areas, when they're developed, they all get footpaths on both sides. ",""
"","A","Straight away? ",""
"","B","Straight away.  And we haven't got one yet!  We've got a garbage service now. ",""
"","A","You didn't have that? ",""
"","B","We didn't have it in the early times.  But the garbage ... we've got now, which is good. ",""
"2.29","A","And what about the sewerage?  Did you have ...? ",""
"","B","We had to put the sewer on and that would be about 15 years ago.  Yes. ",""
"","A","But before that? We had a pan. You had the old out-door toilet down the back? ",""
"","B","Outdoor, yes.  Toilet down the back and the toilet man used to come once a week.  And you were lucky if you didn't get caught!  (Laughs) ",""
"","A","Didn't they come at night? ",""
"","B","15 Or early hours in the morning!  But ... like when you had to travel to Auburn, we were up at five o'clock in the morning, so ... ",""
"","A","That would be a bit nervous-making on that morning? ",""
"","B","Yes. ",""
"3.12","A","And you didn't have a telephone either? ",""
"","B","No we never got the telephone until '74. ",""
"","A","That's very late isn't it? ",""
"","B","Yes. ",""
"","A","And was that the manual exchange? The automatic exchange didn't come through till then? ",""
"","B","Yes.  Didn't come through till about that time. ",""
"","A","And what did you do for telephoning before that? ",""
"","B","Well if ... the neighbour one, or we'd have to go down to the public telephone.  There was a public telephone down near the Post Office. ",""
"","A","And you never felt the need to have one really before that? ",""
"","B","No. ",""
"3.46","B","Oh, well I think we've just about covered everything.  Is there is anything else you can think of that ... ? ",""
"","A","No.  I don't think so. Did you have any animals - any pet animals? ",""
"","B","We used to have chooks, a few chooks.  We've always had a dog and a cat. ",""
"","A","And did you have a cow? ",""
"","B","No not here? ",""
"","A","Did your father have a cow?  ",""
"","B","Yes we used to have cows at home. ",""
"","A","Did you milk them as a child? ",""
"","B","Yes. ",""
"","A","And he had chooks too, so you were fairly self-sufficient? ",""
"","B","Oh, yes. ",""
"4.21","A","Well just one last question.  Looking back on your life - you had a fairly busy life as a child - do you feel that you were hardly done by, that you had a hard life?  How do you feel about it? ",""
"","B","No.  I don't think I do.  I think that I had a life of what I ... like I was expected to do it and I did it!  I wouldn't have changed it!  And I wouldn't have changed any of it! 16 ",""
"","A","Which is a bit different probably - if a young girl today was left in the circumstances you were at the age of eight and having to look after a family ... ",""
"","B","Oh they wouldn't do that now. ",""
"","A","They'd find it very hard to do that now. ",""
"5.12","A","Well I think that's it.  Thank you very much. ",""
"","B","17 ",""
