"time","speaker","text","notes"
"","A","Yes.  There's a lot of talk of alcohol in schools and that sort of thing now. ",""
"","B","Yes.  Well I was here by myself the other night and I thought oh - they advertised a Max Gillies play - and I thought 'Oh, I don't mind  Max Gillies you know, the ABC ...&apos; I put it on.  Well!  The first sentence he said:   four letter word - 'Oh, my so-and-so leg!'  I just hit the - I've got a remote control - I just hit the button and turned it off.  I think it's unnecessary.  People can't express themselves without using bad language.  I feel sorry for them.  They've got a poor grip of the English language if they've got to resort to that type of thing. ",""
"","A","And so did your children watch a lot of television when it first came in? ",""
"","B","No.  It was controlled.  My son was only saying the other day - we were over there and he said:  'Oh the things that kids watch on TV and the way that kids are now!'  and he said &apos;What caused it?' and I said 'Parental control!&apos;  I said &apos;You just think back&apos;.  I said &apos;You were never allowed to have loud music on’ I said &quot;I used to say &quot;This is my house and I don't want it.  If you want to listen to it you take it to your bedroom and turn it down and put the head phones on.&quot; ‘I said 'You were never allowed...'  I said &apos;Do you remember the things you weren&apos;t allowed to remember on TV?'  He said 'Yeah, I suppose so.&apos;  (Laughs). ",""
"1.41","A","So even then when your children were growing up, there still weren't many neighbours around? ",""
"","B","Oh, no.  No. ",""
"","A","There was still a nice feeling of space around ...? ",""
"","B","Oh well, they started up the back, because I can remember Craig having a dozen boys in the backyard to play with. ",""
"","A","But they still had a fair bit of space around? ",""
"","B","Oh, yes.  Yes, yes.  Both houses were down behind there.  So, there was room. ",""
"2.13","A","And what did your children do for recreation?  Did they go dancing or to the movies? ",""
"","B","Oh, well Craig was in Scouts and Cubs and all that.   That's what I say, if two dogs met on the corner, Craig would have to be there!   (Laughs).  You know, St. John's Ambulance classes, drumming lessons, whatever, you know.  It doesn't matter that he's not going to become an expert at them.  But he had to be there.  Couldn't be left out of anything.  He's an organiser and a joiner.   ",""
"2.48","A","And did you have a lot of friends in the area through neighbours or through the school clubs and so forth? ",""
"","B","Myself?  Oh, I had acquaintances but not close, close - not really close friends.   Somebody that I used to ... occasionally I might take one of the children for a walk in the stroller in the afternoon and visit them and come home.  Not like my mother had a close friend that lived - oh at least a mile away - at least!   And they used to visit each other.  Maude her name was!  (Laughs).  Maude!  And Maude would come down here and - I think it was Tuesday or Wednesday afternoon - and have afternoon tea.  Mum would have the embroidered table cloth and the sugar and the cakes and the tarts or whatever she'd made, you know, and then the next week - she'd only be here about an hour - and then the next week Mum would go over to Maude's and Maude would have the afternoon tea table set with the embroidered table cloth!  (Laughs) ",""
"","A","They went to so much trouble just for the hour's visit. ",""
"","B","Yes.  That's right.  Maybe two hours at the most.  And to walk that far too! 11 ",""
"4.08","A","She thought nothing of it I suppose? ",""
"","B","No.  No, no. ",""
"","A","And you had a car when your children were growing up so it was easier for you to get around? ",""
"","B","Yes.  Yes.   We used to take them in summer time a lot to the beach.  We found that was a good recreation. ",""
"","A","Which beach did you go to? ",""
"","B","Collaroy mostly.  Or sometimes we'd go down south or we did take them up to Coolangatta. ",""
"4.37","A","And did you go on family picnics and that sort of thing? ",""
"","B","We had barbecues.  Well we went to the beach for our picnics in the summer and we went out into the bush or somewhere for a barbecue in the winter, with relatives. ",""
"4.53","A","And what about after the War - a lot of European migrants moved in - did you find many of them settling around here? ",""
"","B","Yes.  At one stage I was the only Australian in this block of houses here.  But I found them all pretty good. ",""
"","A","What nationality were they? ",""
"","B","Polish ... she's Scottish married to Maltese next door; then there's an Australian, but they used to be Italians in there; and then there was an Australian married to an Italian; and then there's a Yugoslav married to an Italian; and then there's two Yugoslavs; and then there are Italians further down; we had ... and Germans round the corner; Lithuanian married to a German. ",""
"","A","And when would they have moved in here? ",""
"","B","They came after the War.  In the 50's I guess it would have been.  When they started bringing the refugees out from Europe.  Dutch ... but the Dutch mostly seemed to clan together and go out, you know, where one bought a block of land the other one would buy a block of land next to it and they seemed to stick together like a clan. ",""
"","A","And did you find the European people had any effect on life in the area?  You know, did their life style ... ",""
"","B","No.  Except that some of them had to have everything straight away.  'Oh you must do this' and 'You must tell me this' and &apos;How much can I get this for&apos; and ... that was it.  They weren&apos;t willing to wait and go without.  Like when I moved in here I had nothing.  I had one wicker chair.  I had no lounge.  I had a table that had been loaned to me and chairs from my father that had been loaned to me.  And I was happy - not happy - but content to go without until we could afford it and pay cash. ",""
"","A","Right.  You didn't use credit! ",""
"","B","Oh, no.  No credit.  And I felt that some of them had to have it straight away.  And it's strange because they'd been without - they'd been deprived - in Europe for so long. ",""
"7.42","A","Maybe that was why.  They thought they'd come to a new country.  And the industry here now of course has grown enormously.  What sort of industry is there now? ",""
"","B","I don't know ... oh, Case up there make ... it's heavy industry.  Farm machinery and things like that.  I don't know ... 12 ",""
"","A","The factories across here - what do they make? ",""
"","B","I don't know.  I really don't know.  (Laughs).  It&apos;s noisy, whatever it is that he makes!  You know those British Goldmont Gong, the man with the Gong?  I think that's what he is!  (Laughs). ",""
"8.22","A","Making that noise!   So when you think back on what it was like here when you were growing up as a child and what it developed into after the War with more population moving out to the west, what are your main feelings about it? ",""
"","B","There are some things that have their advantages, like medical facilities, shopping's easy.  I rarely go out of St. Marys to buy anything now.  I think the only thing I'd have to leave here for would be to buy furniture. ",""
"","A","And where would you go for that? ",""
"","B","I don't know.  That'd depend on what I wanted.  Parramatta - furniture shops are everywhere, but not here.  Electrical shop's here.  But all in all it's lost its village atmosphere where you go down the street and you'd meet someone.  You knew you were going to meet someone and have a little chat.  You never see anyone you know now.  Never.  'Cause I think the population's something up close to 100,000 now.  'Cause by the year 2000 I think St. Marys and Penrith their estimating 200,000? ",""
"","A","I think it might be more!  And what other things have changed for the better or for the worse?  How has it affected you? ",""
"","B","The noise of course.  I just don't have to ... rarely do I go away from here to buy anything - even Christmas shopping.  No ... I can't put my finger on what it is but it's just sort of lost its friendly atmosphere ... ",""
"","A","And the sense of security that you were talking about? ",""
"","B","Oh yes, oh yes.  You never know who to trust.  We had a big storm here one night.  Oh, it was dreadful, and the poor old Labrador that I had used to go berserk when she got older.  When she was young she used to ignore it.  She used to go berserk.  And this night we had this dreadful storm and she kept coming into my bedroom beside my bed and going 'mm..mm..mm..mm' and I ... in the end I thought &apos;She&apos;s not going to leave me alone, I&apos;m going to have to get up and go out there with her.  Not that you could do anything for her.  When I got out there Nick was already out of his room, sitting there, and I said 'Oh she got you up too!'   I said 'What did she want me for?&apos;  Anyhow, of course we had the lights on, and I said 'Well she's not going to let us sleep, I may as well go and have a cup of coffee while I&apos;m sitting here.  This is about half past three in the morning.  We had the light on.  The next think there was a knock at the door - and it's still teaming cats and dogs - and I opened the inside door - not the outside one - and there was a young fellow standing there and it was just as though you'd picked him out of the sea like that.  He was plastered with water, just drenched!  He said 'Oh' he said &apos;I&apos;m sorry to trouble you but I saw your light on.  Would you mind ringing for a taxi for me?'  And I said 'No&apos;.  I thought &apos;No, I&apos;m not asking you in!&apos;  I said &apos;I&apos;m sorry I can't ask you in'.  He said &apos;No that&apos;s all right, I couldn&apos;t come in anyway, but I&apos;ll just stand up there'.  He was shivering - it was cold!  Anyhow I said afterwards - he'd wanted this taxi - and I said afterwards 'Now isn't that dreadful to think that a person&apos; ... I said &apos;Years ago you&apos;d have invited that person in, given them a rug to put round them and given them a cup of coffee to warm them up'.  I said &quot;I wouldn't have opened ...&quot;   He asked me for a cigarette.  I wasn&apos;t going to open the door and give him a cigarette.  No way. ",""
"","A","And you've had those three men try to knock the door down recently! ",""
"","B","Yes.  Kick it down!  She said they were kicking and ... they got it open, and they broke the handle off the one round the corner - off the security door. 13 ",""
"13.16","A","The security angle is one that has changed. ",""
"","B","Yes that's a bad one, yes. ",""
"","A","And what about the way children live in the area now?  Do you think that has changed much? ",""
"","B","I don't know.  I don't have much to do with the children now.  I always say &apos;I&apos;ve reared mine - I'm shuck of other people's&apos;. ",""
"13.45","A","Your upbringing and your children's upbringing - was there much difference? ",""
"","B","No.  I don't think so.  I really don't.  Except that I was a loner and they had each other to fight with.  And, boy, do you know how many pairs you make out of three children? ",""
"","A","How many? ",""
"","B","You can make three!  You can make that one and that one; that one and that one; and that one and that one.  (Laughs)  And there's always two against one somewhere. ",""
"14.20","A","And what about the landscape, how that's changed since before the War? ",""
"","B","Well we had beautiful natural flora and fauna.  There were foxes over there.  I know they're - what do they class them as? - a pest or rodent now?  And the rabbit man used to come with his basket and the rabbits in it, you know, with a white cloth over it.  Caught the rabbits over there - one and six a pair!  What are they now?  About four dollars each! ",""
"","A","A luxury! ",""
"","B","I couldn't bring myself to eat them now.  Mum used to do all sorts of things with rabbits - she'd bake them, she'd stew them, she&apos;d curry them, she&apos;d fricassee them! (Laughs). ",""
"","A","They taste good too! ",""
"","B","They used to.  I used to love it.  But I haven't been able to buy rabbit since I was a kid - I had a pet one.  (Laughs).  I mean all flora that was here ... I see them now showing natural Australian things on TV and I often say ‘We used to have that growing round here!'.  We used to have the little fly-catchers, you know like little honey-dews?  With the ... we used to have them here.  We used to have ground berries and five-corners.  We used to go and pick and eat. ",""
"","A","Five-corners? ",""
"","B","Five-corners.  Do you know what five-corners ...? ",""
"","A","No. ",""
"","B","Oh.  Nobody ... I've only ever found one person who knew what a five-corner was.  That was a fellow from Canberra.  I mentioned five-corners one day and he said 'Do you know what they are?' and I said 'Yes&apos;. ",""
"","A","A little fruit is it? ",""
"","B","Yes.  It's a spikey little plant that grows like that with sharp whats-a-name, and the berries grow in like that, and they're sweet.  They're nicer than the old granberries are.  Oh well they're a pretty little prickly bush that grows flat on the ground.  You lift them up and pull the berries off them and eat them.  But the five-corners are the nicer ones of the two.  They grow up from the bush like that.  But sago bushes and things like that that used to grow. ",""
"","A","Did you pick your own sago? ",""
"","B","14 No, no, no, no.  It has a flower on it like that.  It's just a shrub.  It has a flower and it's just like a lot of sago on the top. ",""
"","A","And so you don't see any of those things anymore? ",""
"","B","You don't see any .... chocolate flowers!   ",""
"","A","I've never heard of them ",""
"","B","Oh they're beautiful.  They're a little purple flower and they grow in the ground and they smell just like milk chocolate!   ",""
"","A","Really! ",""
"","B","Little purple ... and little ground orchids, you know.  Oh, I don't know what they call them.  We used to call them orchids - bush orchids - but they had little yellow flowers with brown spots on them.  Just like little orchids they were. ",""
"17.39","A","So you don't see anything like that anymore? ",""
"","B","You don't see anything.  It's all been bulldozed.  It&apos;s all gone.  &apos;Course we don&apos;t see the bull ants now either - you know those big bull ants? (Laughs). ",""
"17.45","A","That's a good thing!  And of course you've got all the industry over here to look at instead of the bush. ",""
"","B","Oh, that's dreadful.  It's an eyesore.  An absolute eyesore.  But we used to take ... we went through - well, that wasn’t' mooted until 1972 or 3 over there.  We used to take the three children for a walk through - crossed over the railway line and down the other side - and the kids used to love it.  There were little dells where the little bush ferns grew and chocolate flowers!  (Laughs). ",""
"","A","It sounds magic! ",""
"","B","It was!  And the kids used to absolutely adore it.  &quot;Oh we're going for a walk!' you know, through the .... and they used to adore it - go right down to the creek down there and walk along the creek and come back again.  It's all gone! ",""
"18.46","A","I think that's just about covered everything really, unless you can think of anything else you'd like to tell me about? ",""
"18.58","B","I can't think of anything.  Did I mention on that tape - on that tape - about walking home from the railway station on the ....? ",""
"","A","No.  What ... this was when you were coming home at night? ",""
"","B","Yes.  Coming home at one o'clock in the morning and there'd be bush each side.  No worries!  Never worried about anything. ",""
"","A","And how far was that to walk? ",""
"","B","About half a mile.  It's half a mile from that corner - that used to go straight through down to the station. ",""
"","A","Your parents didn't worry about you coming home late at night? ",""
"","B","No.  I suppose my mother would have worried if I had not been in by, say, quarter past one, you know, because a ten minute walk up from the station.  But I was so envious of the girls that lived in the city, you know, and they could catch a tram and go ... and I used to have this long train trip home.  Have a sleep on the way home of course. 15 ",""
"19.57","A","And the trains were safe in those days too? ",""
"","B","They were, yes.  Oh, definitely.  You wouldn't have any trouble on the trains. My eldest daughter's had a couple of nasty experiences on the train in the daytime! ",""
"20.20","A","Has she?  I think about the only thing I haven't asked you about really was the transport and the roads.  You know, there wasn't much bus transport I believe in the area ... ",""
"","B","No, the buses didn't start here until ... it must have been the '50s I think.  There was a taxi! ",""
"","A","Oh was there?  One? ",""
"","B","Yes.  (Laughs).  Oh and it used to hold a pile of people.  It had seats that folded down and ... oh, I can't remember ... and his name was Darling or Darlington, his surname, and they used to hire him to take them to Penrith pictures on Saturday afternoon, and they used to pay a shilling each.  My mother and me and a couple of sisters and, you know, whoever.  They'd get a load for him and pay a shilling each for the taxi.  And he'd be there waiting for us when we came out of the theatre.  We used to have a theatre in St. Marys too.   ",""
"","A","Did you? ",""
"","B","When was that opened?  In the l9 ...  it must have been in the '50s.  And then with the advent of TV of course - I went down there one night to see &quot;Long Hot Summer&quot; I think it was and there were 18 people in the theatre.  It held 999!  So he went down the drain. ",""
"","A","Goodness! Well I think we've just about covered everything, so thank you very much for your time. You're welcome. ",""
"21.59","B","We used to ... if we got a penny to spend we used to go down to the grocers where they had a cardboard box and would had 'lamp-posts' in it, which was a stick with a triangle - a cone - of red or green hard lolly on the top, or marshmallow clocks or cigars - marshmallow cigars with chocolate on the end of them.  What else did they have in that box?  Oh, penny creamy toffees, oh, aniseed sticks, oh I can't think of all the things. ",""
"","A","All for a penny? ",""
"","B",".A penny each and if you were lucky and you got there ... oh, the little cone - the penny icecream cone - that was filled with sherbet and marshmallow on the top and hundreds and thousands stuck in the marshmallow.  And if you were lucky and they opened a new box, you had a pick of all that   It was absolutely wonderful!  Oh, dear they were great! ",""
"","A","That was when you were a child? ",""
"","B","When I was a child, yes.  It was really great, you know, to get ... or if you wanted something that was going to last a bit longer you'd get a penny’s worth of boiled lollies.  The grocer used to get a piece of paper and twist it into like an icecream cone around his hand, twist the bottom of it, fill it with boiled lollies out of the jar and then that was your penny worth of lollies.   ",""
"","A","These days everything's pre-packaged isn't it? ",""
"","B","Oh yes.  I'd love to be able to buy some loose biscuits for a change, instead of buying a full 250 grams of one sort of biscuit, you know.  I'd like to be able to say 'Oh well I&apos;ll have a few of these and a few of those and a few of something else'. ",""
"24.03","A","END OF TAPE   ",""
"","B","16 ",""
