"time","speaker","text","notes"
"","","","INTERVIEW NO. 17 DATE OF INTERVIEW: 20/11/91  MRS. JOY WILLIS, 74 HOBART STREET ST. MARYS.  NSW. "
"0.13","B","My name is Joy Willis.  I live at 74 Hobart Street, St. Marys.  I was born on 5th February, 1926 at St. Marys.  My marital status - I'm widowed.  Nationality - Australian, with three children. ",""
"0.42","A","First of all I'd like to ask you a few questions about your family background.  What kind of work did your father do? ",""
"","B","He was a sheet-metal worker at Reckitt and Coleman in Sydney. ",""
"","A","And your mother?  Did she work? ",""
"","B","No.  She stayed home and looked after the house, the family, did the cooking and the shopping and all that type of thing.  Women didn't work in those days, they did their household chores and looked after their families. ",""
"","A","And so when you came to this area - you were actually born in this area? ",""
"","B","Yes I was born in the house next door to here. ",""
"","A","So you've lived here all your life? ",""
"","B","Lived here all my life and I was virtually an only child because my brother and sister were ten and 12 years older than I was. ",""
"1.46","A","And so you went to school from here?  Was that far to travel? ",""
"","B","No, it was about a mile ... or more ... a little bit more.  It was all bush all the way through, you used to walk through the bush and you know there was no fear and worry or ... someone was going to grab you or ... . There were a couple of old men that lived in tents that were - not tramps - they were ... it was in the Depression.  They had nowhere to live.  And I was always warned &quot;Don't go near those tents&quot;.  But I think they were quite honorable old men!  (Laughs).   ",""
"","A","And you walked by yourself? ",""
"","B","I walked by myself. ",""
"2.31","A","And what was the land like here?  Was it a big block of land that you father's house was on? ",""
"","B","It was seven acres.  And I think they originally intended to poultry farm it, but the foxes took half the stock one night and someone else took the other half the next night!   ",""
"","A","So you didn't have many close neighbours? ",""
"","B","No.  There was one about a quarter of a mile away and another one ... oh about the same distance up the other way, and she had a car!   An old, you know ... I don't know, I suppose it was an old Ford of some sort.  And she was always telling me as a child she was going to buy an aeroplane because they were the same to drive as the car!  (Laughs) ",""
"3.20","A","She was progressive!  And did your family have a car? ",""
"","B","Oh, no!  No, we never had one. 2 ",""
"","A","How did you get about?  You lived near the railway of course. ",""
"","B","Yes, a half mile walk to the station.  We used to go in as a child - every Saturday morning I was taken into Sydney, either taken to the movies or ... something like that, you know.  An outing!  I was privileged I suppose because there were so many children from the Depression that didn't even have a pair of shoes, but I didn't realise that. ",""
"","A","So you were comfortably looked after? ",""
"","B","We were.  Yes.  My father was in constant work.  I was talking to a friend recently who was at school with me and she was telling me that her father - there were six in her family - and she said they never knew what money was.  She said 'Until War broke out and Dad joined the Army' she said 'we&apos;d never had money.  We had dole coupons&apos;.  She said &apos;There was never any money in the house'.  And I never realised this.  I used to think that I was badly done by because when I used to take my lunch to school it was wrapped in grease-proof paper and sometimes there was a girl used to bring hers in a white serviette.  And I used to think &quot;Badly done by!&quot;.  But there were some poor children that had them wrapped in newspaper!  Bare feet and they had newspaper-wrapped sandwiches! ",""
"5.03","A","Did your parents use their garden to grow vegetables? ",""
"","B","No.  They grew - my mother was more into flowers.  I think she bought all her vegetables.  I don't remember her growing them. ",""
"","A","Did she have her shopping delivered from the local shops? ",""
"","B","Yes the butcher used to call and take an order; the grocer used to come on Thursday and take an order and bring it back on Friday with his horse and dray; and the milkman used to come twice a day, first of all in a cart and then later on his son used to come with the milk can on the handles of a pushbike - half pint morning and night, you see, because there were no refrigerators. ",""
"5.57","A","You had an ice-chest did you? ",""
"","B","Had an ice-chest, yes.  We were one of the lucky ones with an ice-chest.   ",""
"","A","And I don't suppose you had any electrical appliances when you were a young child did you?  Like vacuum cleaners or anything? ",""
"","B","No.  We didn't get the electricity on until about 1939 or '40.  Oh we had the water, because my father paid to have a private line brought down the footpath onto the house.  We had an underground well and a tank up the top that you pumped the water up into the tank, and he had laid the water on into the laundry out the back and into the kitchen.  So we had laid on water. ",""
"6.41","A","You didn't have a sewer, I suppose? ",""
"","B","Oh, no!   (Laughs) ",""
"","A","Where was the toilet?  Way up the back, or .. ",""
"","B","Yes.  Out the back, yes.   Down the corner of the block. ",""
"6.51","A","So when you were a child what did you do for recreation. ",""
"","B","Well I had no-one to play with for a long time.   ",""
"","A","There were no neighbours ...? ",""
"","B","3 No neighbours.  None with children anyway.  I used to paint and read, sew, all those things kids do, you know - by themselves!  But now they sit and they say &quot;I've got nothing to doooo!&quot; (Laughs) ",""
"7.21","A","So you had to entertain yourself? ",""
"","B","Had to entertain yourself.  Later on there were three girls came to live up the top of the hill and we used to play together.  Cubby houses and things like that. ",""
"","A","Did you have any family pets? ",""
"","B","Yes.  I had an old Cattle Dog.  It regularly had puppies, and I used to play with them.  I used to plug them into the teats, and then pull them off and say &quot;You've had enough, you go on there!&quot;.  (Laughs).  We used to have cattlemen.  There were cattle sale yards down near the station and the cattlemen used to  - on this paddock here we had a dam that my father had dug down the bottom - and they used to rest the cattle on there.  And they used to wait for Prinnie to have her pups 'cause she had lovely pups.  They used to buy them for cattle dog - to look after the cattle, you know. ",""
"8.23","A","And so the shopping area was very small when you were a child? ",""
"","B","It was very small.  There were two grocers; there were two butchers; a post office down on the highway, where my mother used to walk every day to collect the mail before we had mail delivery.  What else was there?  There was a newspaper shop, cum milk-bar cum delicatessen, cum anything else you like to think of, down on the highway.  And there's a bank.  The Commonwealth Bank have always been here. ",""
"9.01","A","So what did you do when you left primary school?  Did you go to high school locally? ",""
"","B","Yes.  I went to Penrith High School.  I had to travel there by train.  There was only Penrith High School, Katoomba High School, Richmond High School and Paramatta High School. ",""
"","A","So you went to Penrith by train. ",""
"","B","I went to Penrith. ",""
"","A","And after that did you go on to any tertiary study or to tech or anything like that? ",""
"","B","No.  I wanted to become a French teacher actually.  I was very interested in French.  And my mother - when I finished my Intermediate Certificate - she said to me 'Where do you want to work’ and I thought 'Oh, beauty', you know, &apos;I don&apos;t have to go to school anymore!&apos;.  (Laughs) ",""
"9.57","A","So you worked locally? ",""
"","B","No.  I worked in the city.  During the War you were Manpower and you had to go where they sent you, and you couldn't leave.  I worked there from the time I left school until 1945, and you were released. ",""
"10.13","A","And can you remember what sort of money you earned when you first started work? ",""
"","B","Yes.  I got nineteen and ten pence for the first three months and then IO got a rise to a pound and twopence.  I think the twopence was the tram fare up to the station because you couldn't have got on a tram with a pound note. (Laughs).  I've heard of people recently who've only got - Joan Reece down here only got seventeen and six or something when she first started work. ",""
"","A","You were on a good wage? ",""
"","B","I was on a good wage.   A good thing. 4 ",""
"","A","And you worked - was it factory work you were doing? ",""
"","B","Yes.  War work. ",""
"","A","Making things like nets and ...? ",""
"","B","Making parts for - it was STC - parts for radios and that type of thing - communications. ",""
"","A","So I suppose most of your age-group in this area did that sort of work? ",""
"","B","I don't know what they did.  But there was no work here except the occasional job in a shop.  You had to move out of St. Marys or travel from St. Marys to get work.  There were a few more shops in Penrith. You could go to work up there if you could get it.  But I didn't want to spend the rest of my life here - Sydney was too good! ",""
"11.40","A","And when you were married - when was that? ",""
"","B","1947. ",""
"","A","Right.  And you lived in your parent's home? ",""
"","B","Yes I lived with them until ... while this house was being built, which took about four years - three to four years or so.  And by that time I had my second child. ",""
"12.02","A","So this is a timber house is it, or ...? ",""
"","B","It's a timber house.  But I've had cladding put on it.  I couldn&apos;t afford the upkeep.   ",""
"","A","So you built a timber house and it was hard to get materials after the War? ",""
"","B","Terribly hard.  You couldn't get anything.  You had to order it.  I remember we sent in an order for tiles to Wunderlich, and they sent it back and said we could send it in in another six months and they'd tell us whether they'd accept it then or not.  (Laughs).  That&apos;s how bad it was! ",""
"","A","Did you have any children before you moved into your house? ",""
"","B","Oh, yes.  I had the two of them. ",""
"","A","And you had another one after you moved. ",""
"","B","One after.  Three of them were born up at Penrith Hospital? ",""
"13.01","A","So you planned your children did you? ",""
"","B","Oh.     (Knocked microphone.)  Sorry. ",""
"13.09","A","And what were the medical facilities like in the area? ",""
"","B","Well, after the War we had two more doctors move in, but before that we had one. ",""
"","A","When you were a child? ",""
"","B","When I was a child there was one doctor and - it was old Teddy Day - and his daughter then graduated and she became a doctor too.  So the two of them were in the practice.  Mum had actually booked the doctor for me when she was going to have me.  She had me suddenly at home you see, and the doctor came down afterwards and he said 'Can I see Mrs. Joiner?' and Mum called out from in the bedroom 'Don't let him in!  He&apos;s not going to hold my hand and say &quot;How are you&quot; and charge me a guinea!'  (Laughs).  He said 'Well, can&apos;t I just come in and have a look at the baby?'. 5 ",""
"14.16","A","And so by the time you had your children, you had all three in the hospital? ",""
"","B","Oh, yes.  Facilities were much better then. ",""
"","A","What happened if there was an emergency in the old days - when you were a child? ",""
"","B","I don't know.  Oh, well I suppose they just had to take them up to Penrith Hospital.  There was an ambulance service then.  But I know my sister had a big operation during the War - a lung operation - and she had to have it dressed every second day.  She was evacuated from Prince Henry Hospital because of the War and because they couldn't get petrol, they had to buy a horse and sulky.  And her husband used to take her up to Penrith Hospital by horse and sulky every second day to get the dressing and the tube cleaned out - the drain tube in it. ",""
"15.20","A","Where was that?  Where did they live? ",""
"","B","They lived in St. Marys, yes. ",""
"","A","So they had to go all that way by sulky?   ",""
"","B","Yes.    ",""
"15.30","A","So after you were married and you moved in here, what was it like?  Was it still very sparse as far as neighbours were concerned? ",""
"","B","Oh yes.   I'm trying to think.   Yes, there was no-one.  This was all ... of course my father owned that land.  There was nothing around here.  These were only built - these War Service Homes behind - in ... oh, it must have been the '60s I think. ",""
"","A","So it was still all bush really? ",""
"","B","It was still all bush, yes.  After the War they did build Housing Commission houses up on top of the hill, and that was the beginning of the rot, you know.  That's when the village developed from a village into (laughs) whatever it is now! ",""
"16.23","A","When you were a child, what was it like around here?  What was the landscape like? ",""
"","B","Oh, it was absolutely beautiful.  Over the other side of the railway line was virgin bush. ",""
"","A","Where all the factories are now? ",""
"","B","Where all the factories are now, which are an absolute eyesore - not aesthetic at all.  And I used to have - in the '50s - I used to have as many as 14 Kookaburras come and sit on the clothes line twice a day to be fed.  Now, if you hear a Kookaburra ... 'Listen, listen, that was a Kookaburra!', you know.  You're quite taken aback by it.   ",""
"","A","You'd hear more trains that anything else I suppose? ",""
"","B","More trains ... well, actually being so close to the line, the trains - you don't hear them so much.  If I'm talking to the neighbour up the back up there you hear them further away and the further you get the longer you hear them.  But here they just go 'zshoooop', you know. ",""
"17.31","A","So it's not so bad?  And did you have electrical appliances when you were first married? ",""
"","B","Yes I had a few.  The iron and the jug and the toaster and a fridge by then, an electric stove.  I didn't have to clean the fuel stove that Mum had and used to black every Friday, you know.  And gone were the candles and all that type of thing.  But during ... when I had my eldest child and the second one - we used to meet everyone up at the clinic and you knew everybody in St. Marys.  This was before the population swelled, and you'd go down the street shopping and leave your pram - put the break on and leave the pram outside the shop while you went in 6 and got it - got whatever you wanted - and you'd know all the prams.   You'd say, &apos;Oh, look!  Molly's down here today!  There's Gordon in his pram!&apos;  And you wouldn&apos;t dare leave your child in the pram outside anywhere now. ",""
"","A","That's one way the place has changed. ",""
"","B","Oh yes.  Not for the better. ",""
"18.45","A","You have security here now too? ",""
"","B","Oh, doors, windows - everything!  I've even inquired into a burglar alarm.  The trouble is they can be a little bit troublesome too.  We've got the keys to next door because he's got one and it's gone off twice with nobody in there. ",""
"","A","Oh, that's a worry. ",""
"","B","He left the keys so we could turn it off if it does go off. ",""
"","A","But you do have ... you have had burglaries here?  Quite a few? ",""
"","B","Oh, yes.  Not a few, but I've had two.  We were up in Townsville and the video and some money and some jewellery and what-have-you ... they broke the back window and got in there.  And then a couple of years later I had the lawnmower taken.   ",""
"","A","From the shed? ",""
"","B","From the shed, yes.  But it's chained up and locked now! ",""
"","A","And you've got a dog! ",""
"","B","And the lawnmower's not there.  It's in the garage now.  They&apos;ve got to move the car out to get the lawnmower out now! ",""
"","A","And you've got the dog specially? ",""
"","B","And the dog especially. ",""
"19.59","A","That's a change from the days when you could go out and leave everything open! ",""
"","B","Leave everything - the windows open - if you go down the street if you weren't going to be that long, you know.  I used to lie down and have a sleep in the afternoon when the children were asleep, you know put them down, and the neighbour used to come up and she'd say to me 'One of these days you're going to get raped.  You will leave that front door open won&apos;t you!'  (Laughs).  And now she berates me the other way because she says 'Your doors always locked'.  (Laughs). ",""
"20.37","A","And what did you do for shopping in the '50s?   Did you still have things delivered, or did you have to go to the shops as well? ",""
"","B","No. my husband used to take me.  I'd go to the clinic with the baby in the pram or the stroller, and I'd do my shopping and he'd come and pick me up and bring it all home. ",""
"","A","You had a car then? ",""
"","B","Yes.  Yes, we were one of the 'top-knots'!  (Laughs).  You didn&apos;t have a push-bike anymore! ",""
"21.07","A","So, looking at the ... oh, you went to the local school here, and did your children also go to the local school? ",""
"","B","7 Yes.  They went to the same school that I went to here and by that time we had a high school.  The three of them went to St. Marys High School. ",""
"","A","Did they walk there? ",""
"","B","Yes. ",""
"","A","It was close enough.  And did any of them go on to tertiary education? ",""
"","B","Not university.  But they did other things.  The youngest one went to a business course because she couldn't get a job, and the master of the Tech College said to her 'This is ridiculous with the pass that you've got and you can't get in - come and see me!&apos;   So she was in the next day!  And so she did that, and my son has done business courses, you know ... what do you call them? ",""
"","A","Management courses? ",""
"","B","Management courses, yes.  He's got his own business now. ",""
"","A","And what about the other one? ",""
"","B","Oh, well she's married and she's living in Townsville and she&apos;s got two children.  I don&apos;t see much of her because it's so far away.  It's too hot for me up there.  I&apos;ve got to go mid-winter if I want to go up there! ",""
"22.38","A","What about your daily routine in the '50s?  How would that have differed from you mother's daily routine say in the '30&apos;s, you know? ",""
"","B","Oh, I don't know.  I did the housework and the washing and the ironing, which she used ... but I did it the easy way.  She used to have the fuel copper that she used to have to stoke up and get boiling before she (laughs) put the clothes in.  Of course I had the washing machine and all that type of thing by then. ",""
"","A","So you were basically doing the same sort of thing but with a bit more help? ",""
"","B","Easier.  It was lighter.  And I used to do a lot of sewing. ",""
"","A","Did you?  Did you make your children's clothes? ",""
"","B","All of them - except their socks and singlets! (Laughs). ",""
"","A","And your mother did the same for you did she? ",""
"","B","Yes.  Yes. ",""
"23.50","A","And what about finances.  Did you and your husband pool finances or was he the breadwinner and give you ...? ",""
"","B","Yes.  I didn't work.   I didn't have any income. ",""
"","A","And did he give you a certain amount each week? ",""
"","B","Yes.  For the household and he used to pay all the bills.  I got a rude shock when he died. ",""
"","A","You had to learn how to ...? ",""
"","B","I had to learn.  I'd never written a cheque even!  The bank manager said to me 'Oh you&apos;ll need a cheque book' and I said 'But I don&apos;t know how to write a cheque!&apos; and he said &apos;Well I&apos;ll show you.' 8 ",""
"","A","When did you lose your husband? ",""
"","B","1971.  And he said 'Well I'll show you.&apos;  I pretty soon got on top of it and once the house was paid - we still had a couple of years to pay on the house - and I just felt lovely to be free of debt and no encumbrances or anything. ",""
"","A","So he managed the finances during your marriage? ",""
"","B","Oh yes.  I just managed the food side of it. ",""
"24.55","A","And what about industry in the area?  When you were growing up here I don't suppose there was very much industry at all? ",""
"","B","Oh, there were tanneries and there was a cannery - one or two canneries - a jam factory.  What else ... a lot of the men used to do what they called wood-cutting.  I don't know what it involved but you used to see them with their axes on a bush bike pedalling out that way. ",""
"","A","Oh yes, cutting timber? ",""
"","B","Cutting timber.  Yes.  He was a timber cutter, you know.  We used to buy our fire wood. ",""
"25.34","A","What did your husband do? ",""
"","B","He was an engineer. ",""
"","A","He worked locally did he? ",""
"","B","Yes.  He worked locally. ",""
"25.44","A","So did you have much help with the children? ",""
"","B","No.  None.  He worked - the hours were too long. ",""
"","A","But you had your family nearby so you had some sort of support? ",""
"","B","Oh, well Mum died in 1953, just before my second one was born.  So I really had no help at all.  She did help me with the first one. ",""
"","A","And you didn't have many neighbours either for help? ",""
"","B","No, no.   No neighbours. ",""
"","A","You had to manage as best you could? ",""
"","B","I had to manage.  And you find out you can do it. ",""
"26.22","A","Did you belong to any community organisations? ",""
"","B","No.  Only the school, when the children went to school.  The Mothers' Club and P &amp; C - and highschool P &amp; C.  That was it.  I'm not a club .... my name was Joiner when I was born, but I'm not a joiner, you know!  (Laughs).  I'm not a people person.  I&apos;m quite happy by myself.  I suppose that's encapsulated like as I was when I was a child. ",""
"","A","You had to find your own fun? ",""
"","B","That's right.  And that's why I get so annoyed when these kids with all their video games and TVs and everything else that they've got - and they get bored!  They've got nothing to do!  It&apos;s pathetic I think. 9 ",""
"27.13","A","And when you say you quite like being along, when you were younger and there was no ... the area was fairly open and there weren't many houses, did you ever feel lonely or isolated? ",""
"","B","No, no.  I used to do things ... I'd find things to do.  I used to think that wouldn't it be wonderful if I could juggle, and I'd try!  (Laughs).  I never ever could.  Or if I could whirl a lasso!  And I'd try, but I never could.  And I used to get - you know the little tobacco tins with the hinged lid that men used to have? - I used to get those and I used to put ants in them and dig a hole and bury them (laughs) and leave them to see how long it would be.  (Laughs).  I'd dig them up and see if they were dead.  And they never ever were.  They must be able to live for a long, long time without seeing daylight. ",""
"","A","So you were doing scientific experiments? ",""
"","B","Oh I suppose so.  If that's scientific! ",""
"28.25","A","And when the area started to get more built up how did you feel about that? ",""
"","B","Oh I didn't mind in the first place.  But then suddenly when they were right on my doorstep I sort of resented it.  Next door there the block was too small to have a house on it, and their windows - the bathroom, toilet, bedroom window - was right beside mine. ",""
"","A","There was a lack of privacy? ",""
"","B","Yes.  And the kids turn on the radio and they talk to each other in the bathroom and you can hear them put the soap down in the rack when they have a shower.  (Laughs).  And I always say I'd love one of those domes of silence over my house, you know.  If only I could get that I'd be happy.  I do love peace and quiet. ",""
"29.17","A","And that's one of the things that you've lost really with suburbanisation? ",""
"","B","I have, yes.  That's right. But they used to have - during the War, before I was married I used to go to them - we had dances everywhere and we used to go ... they had one down here every so often, and I used to chase them round, down to Seven Hills and Parramatta and Sydney, Petersham. ",""
"29.45","A","So dancing was the main entertainment? ",""
"","B","Yes.  Oh, yes.  And if you were too tired to dance you went to the movies to see all the shows that were showing round the movies. ",""
"","A","And by comparison, what did your children do for entertainment in their early teens? ",""
"","B","Oh, well they weren't sort of given that much lee-way because by that time things had started to tighten up.  I know the drugs and drink started to get into the high school just as my eldest girl was leaving in 1965.  There was that blow-up down up about the ... purple hearts was it?  And that's when she was just due to leave.  It started that they couldn't have a party unless they had to have drink there.  So she was monitored very carefully and ... a bit strict I suppose I was with them, but I think it's paid off. ",""
"30.49","A","So that was an effect of the population expansion really that in a sense they lost a bit of freedom? ",""
"","B","Yes.  But not only that I think another part of it was all this raunchy racy music with the racy lyrics and all that sort of thing.  Rock music started to come out, and I blame a lot of that on it. ",""
"31.16","B","END OF SIDE A SIDE B 10 ",""
"0.03","B","Then we got the rock music - and it's developed even worse now. ",""
